{
  "version": 1,
  "timestamp": "2019-01-17T14:02:29.364Z",
  "system": {
  },
  "pointset": {
    "sample_rate_sec": 2,
    "points": {
      "space_temperature_sensor": {
      },
      "fan_run_status": {
        "force_value": true
      },
      "fan_run_enable": {
        "force_value": false
      },
      "chilled_water_valve_percentage_command": {
      }
    }
  }
}
