{
  "version": 1,
  "timestamp": "2019-01-17T14:02:29.364Z",
  "system": {
    "max_update_ms": 50000,
    "min_loglevel": 500
  },
  "pointset": {
    "points": {
      "space_temperature_sensor": {
      },
      "fan_run_status": {
        "fix_value": true
      },
      "fan_run_enable": {
        "fix_value": false
      },
       "chilled_water_valve_percentage_command": {
        "min_update_ms": 1000
      }
    }
  }
}
