{
  "version": 1,
  "timestamp": "2018-08-26T21:39:29.364Z",
  "system": {
    "location": {
      "site": "US-SFO-XYY",
      "section": "NW-2F",
      "position": {
        "x": 10,
        "y": 20
      }
    },
    "physical_tag": {
      "asset": {
        "guid": "bim://04aEp5ymD_$u5IxhJN2aGi",
        "site": "US-SFO-XYY",
        "suffix": "extention11-optional",
        "name": "AHU-1"
      }
    }
  },
  "pointset": {
    "points": {
      "return_air_temperature_sensor": {
        "units": "Degrees-Celsius"
      }
    }
  }
}
